{
  "goal_chain": {
    "project": "在不破坏现有 /review 链路的前提下，用 Project GD/ 建设 lab-only /rev 同步 review runner，验证 Goal-Driven + Anti-Fill 长模板机制是否能减少\"格式完整但计划不具体\"的 AI 填表问题。",
    "chain": "如果 SOD 每次全量 Read 33 个 priority 文件，上下文浪费约 26k tokens，且多数文件与当前任务无关。",
    "phase": "改 SOD 加载语义：默认只读 MEMORY.md + USER.md，其他 priority 文件按关键词命中再 Read。",
    "task": "修改 context-guard.md 和 memory-zones.md，添加可执行的命中规则，并通过 3 个 smoke test 验证。"
  },
  "success_criteria": [
    {
      "id": "SC-1",
      "text": "`context-guard.md` 修改后明确：SOD 默认 Read 序列 = MEMORY.md + USER.md，其他按命中规则 Read",
      "verify": "`grep -q 'MEMORY.md.*USER.md' ~/.claude/rules/context-guard.md && echo PASS`"
    },
    {
      "id": "SC-2",
      "text": "`memory-zones.md` 同步更新加载语义描述",
      "verify": "`grep -q '命中规则' ~/.claude/rules/memory-zones.md && echo PASS`"
    },
    {
      "id": "SC-3",
      "text": "命中规则可执行：写在规则文件里，Agent 能按规则判定是否 Read 某文件（关键词匹配 + 优先级）",
      "verify": "`grep -q '关键词来源' ~/.claude/rules/context-guard.md && echo PASS`"
    },
    {
      "id": "SC-4",
      "text": "Smoke test 1：开新会话喊\"做 AKB 翻译\" → Read 列表 ⊇ {USER.md, project_akb_*}，不含无关 feedback",
      "verify": "新会话 transcript 中 SOD 后 Read 列表包含 USER.md + project_akb_*，不含 feedback_eod_*.md"
    },
    {
      "id": "SC-5",
      "text": "Smoke test 2：开新会话喊\"提交代码\" → Read 列表 = {MEMORY.md, USER.md}（最小集）",
      "verify": "新会话 transcript 中 SOD 后 Read 列表 = {MEMORY.md, USER.md}，无其他文件"
    },
    {
      "id": "SC-6",
      "text": "Smoke test 3：开新会话喊\"压缩一下上下文\" → Read 列表 ⊇ {feedback_chinese_after_compaction.md}",
      "verify": "新会话 transcript 中 SOD 后 Read 包含 feedback_chinese_after_compaction.md"
    },
    {
      "id": "SC-7",
      "text": "/context 在 SOD 后的 Messages 区 token 增量 < 8k（基线预估 ~26k 全量 Read）",
      "verify": "SOD 完成后 `/context` 显示 Messages token 增量 < 8000"
    },
    {
      "id": "SC-8",
      "text": "备份快照存在 `<workspace>/_backup/memory-index-first-2026-05-08/`",
      "verify": "`test -d <workspace>/_backup/memory-index-first-2026-05-08 && ls` 显示 context-guard.md + memory-zones.md"
    }
  ],
  "plan_hash": "aa83920cfc00cff2e48d6af3f0d835fa7f09c4cda98eafc75778245ef21f4829",
  "non_goals": [
    "不动 memory 文件本身（位置、内容、三区分层）",
    "不改 Claude Code 的 auto-load 机制（MEMORY.md 仍自动加载）",
    "不改 Phase B 的 lazy rules（B 与 C 互不干扰）",
    "不删除任何 priority 文件",
    "不改 EOD 收割/归档逻辑"
  ],
  "accepted_decisions": []
}
