{
  "goal_chain": {
    "project": "在不破坏现有 /review 链路的前提下，用 Project GD/ 建设 lab-only /rev 同步 review runner，验证 Goal-Driven + Anti-Fill 长模板机制是否能减少\"格式完整但计划不具体\"的 AI 填表问题。",
    "chain": "如果没有 smoke 测试计划，bin/rev 的端到端行为无法被机器验证，Phase 2 验收缺乏可执行基准。",
    "phase": "bin/rev plan 在 smoke 输入上完成一次同步 review，并在 results/ 下生成 prompt.md/raw-output.txt/result.md/result.json。",
    "task": "运行 bin/rev plan fixtures/plans/phase2-good-plan.md --dry-run 后 results/<run-id>/prompt.md 存在，且含 5 个 Markdown section 标题。"
  },
  "success_criteria": [
    {
      "id": "SC-1",
      "text": "bin/rev plan 接受 fixtures/plans/phase2-good-plan.md",
      "verify": "`\"$GD_ROOT/bin/rev\" plan \"$GD_ROOT/fixtures/plans/phase2-good-plan.md\" --dry-run` → exit 0"
    },
    {
      "id": "SC-2",
      "text": "dry-run 生成 prompt.md 含 5 个 section",
      "verify": "`grep -cE '^## (Review Standard|Candidate Baseline|Review Context|Artifact|Output Contract)$' <prompt.md>` → 5"
    },
    {
      "id": "SC-3",
      "text": "rev-baseline extract 成功产出 candidate-baseline.json",
      "verify": "`python3 scripts/rev-baseline.py extract fixtures/plans/phase2-good-plan.md --project-goal-file PROJECT_GOAL.md --out /tmp/t.json` → exit 0"
    }
  ],
  "plan_hash": "6af6e99aead16f67dfa676e989cce08fc229631cc9d58b898d27f8e919becb02",
  "non_goals": [
    "不测试模型输出质量（model verdict 不可控）",
    "不测试 code mode（Phase 3 reserved）",
    "不修改 `~/.claude/**` 任何路径"
  ],
  "accepted_decisions": []
}
